{
  "id": "test-app",
  "name": "Test App",
  "status": "platinum",
  "tb": "@testuser",
  "distro": "arch-baikal",
  "kernel": "ps4-linux-12xx",
  "compatibility": "Works perfectly",
  "notes": "Testing the new fields.",
  "platform": "ps4",
  "store": "psn",
  "tags": ["test"],
  "models": ["pro"],
  "storage": "internal-ssd",
  "performance": "smooth",
  "proof": "https://example.com/proof"
}
